[
  {
    "relationship_id": "REL-001",
    "from_entity": "User",
    "to_entity": "UserRole",
    "relationship_type": "one_to_many",
    "foreign_key": "user_roles.user_id",
    "references": "users.id",
    "required": true,
    "unique": false,
    "index_required": true,
    "nullable": false,
    "migration_ref": "database/migrations/006_create_user_roles.sql",
    "notes": "Constraint física declarada dentro de la migración canónica de la tabla que contiene la FK. DB ON DELETE refleja la constraint SQL real; application_delete_policy refleja la política lógica de aplicación.",
    "db_on_delete": "RESTRICT",
    "application_delete_policy": "logical_cascade"
  },
  {
    "relationship_id": "REL-002",
    "from_entity": "Role",
    "to_entity": "UserRole",
    "relationship_type": "one_to_many",
    "foreign_key": "user_roles.role_id",
    "references": "roles.id",
    "required": true,
    "unique": false,
    "index_required": true,
    "nullable": false,
    "migration_ref": "database/migrations/006_create_user_roles.sql",
    "notes": "Constraint física declarada dentro de la migración canónica de la tabla que contiene la FK. DB ON DELETE refleja la constraint SQL real; application_delete_policy refleja la política lógica de aplicación.",
    "db_on_delete": "RESTRICT",
    "application_delete_policy": "logical_cascade"
  },
  {
    "relationship_id": "REL-003",
    "from_entity": "Role",
    "to_entity": "RolePermission",
    "relationship_type": "one_to_many",
    "foreign_key": "role_permissions.role_id",
    "references": "roles.id",
    "required": true,
    "unique": false,
    "index_required": true,
    "nullable": false,
    "migration_ref": "database/migrations/005_create_role_permissions.sql",
    "notes": "Constraint física declarada dentro de la migración canónica de la tabla que contiene la FK. DB ON DELETE refleja la constraint SQL real; application_delete_policy refleja la política lógica de aplicación.",
    "db_on_delete": "RESTRICT",
    "application_delete_policy": "logical_cascade"
  },
  {
    "relationship_id": "REL-004",
    "from_entity": "Permission",
    "to_entity": "RolePermission",
    "relationship_type": "one_to_many",
    "foreign_key": "role_permissions.permission_id",
    "references": "permissions.id",
    "required": true,
    "unique": false,
    "index_required": true,
    "nullable": false,
    "migration_ref": "database/migrations/005_create_role_permissions.sql",
    "notes": "Constraint física declarada dentro de la migración canónica de la tabla que contiene la FK. DB ON DELETE refleja la constraint SQL real; application_delete_policy refleja la política lógica de aplicación.",
    "db_on_delete": "RESTRICT",
    "application_delete_policy": "logical_cascade"
  },
  {
    "relationship_id": "REL-005",
    "from_entity": "Module",
    "to_entity": "ModuleManifest",
    "relationship_type": "one_to_many_versioned",
    "foreign_key": "module_manifests.module_id",
    "references": "modules.id",
    "required": true,
    "unique": false,
    "index_required": true,
    "nullable": false,
    "migration_ref": "database/migrations/008_create_module_manifests.sql",
    "notes": "Constraint física declarada dentro de la migración canónica de la tabla que contiene la FK. DB ON DELETE refleja la constraint SQL real; application_delete_policy refleja la política lógica de aplicación.",
    "db_on_delete": "RESTRICT",
    "application_delete_policy": "logical_cascade"
  },
  {
    "relationship_id": "REL-006",
    "from_entity": "User",
    "to_entity": "UserContext",
    "relationship_type": "one_to_one",
    "foreign_key": "user_contexts.user_id",
    "references": "users.id",
    "required": true,
    "unique": true,
    "index_required": true,
    "nullable": false,
    "migration_ref": "database/migrations/016_create_user_contexts.sql",
    "notes": "MVP autenticado: user_contexts.user_id es NOT NULL y FK a users.id. El usuario puede existir sin UserContext; si UserContext existe, siempre pertenece a usuario autenticado/provisionado. Onboarding/contexto persistente anónimo queda fuera de alcance hasta ADR propia.",
    "db_on_delete": "RESTRICT",
    "application_delete_policy": "logical_cascade",
    "parent_requires_child": false,
    "child_requires_parent": true,
    "fk_nullable": false,
    "anonymous_allowed": false,
    "requires_authenticated_user": true,
    "db_enforced": true
  },
  {
    "relationship_id": "REL-007",
    "from_entity": "User",
    "to_entity": "OnboardingSession",
    "relationship_type": "one_to_many",
    "foreign_key": "onboarding_sessions.user_id",
    "references": "users.id",
    "required": true,
    "unique": false,
    "index_required": true,
    "nullable": false,
    "migration_ref": "database/migrations/017_create_onboarding_sessions.sql",
    "notes": "MVP autenticado: onboarding_sessions.user_id es NOT NULL y FK a users.id. El usuario puede existir sin OnboardingSession; si OnboardingSession existe, siempre pertenece a usuario autenticado/provisionado. Onboarding persistente anónimo queda fuera de alcance hasta ADR propia.",
    "db_on_delete": "RESTRICT",
    "application_delete_policy": "logical_cascade",
    "parent_requires_child": false,
    "child_requires_parent": true,
    "fk_nullable": false,
    "anonymous_allowed": false,
    "requires_authenticated_user": true,
    "db_enforced": true
  },
  {
    "relationship_id": "REL-008",
    "from_entity": "User",
    "to_entity": "Notification",
    "relationship_type": "one_to_many",
    "foreign_key": "notifications.user_id",
    "references": "users.id",
    "required": false,
    "unique": false,
    "index_required": true,
    "nullable": true,
    "migration_ref": "database/migrations/018_create_notifications.sql",
    "notes": "Constraint física declarada dentro de la migración canónica de la tabla que contiene la FK. DB ON DELETE refleja la constraint SQL real; application_delete_policy refleja la política lógica de aplicación.",
    "db_on_delete": "RESTRICT",
    "application_delete_policy": "logical_cascade"
  },
  {
    "relationship_id": "REL-009",
    "from_entity": "User",
    "to_entity": "ProgressRecord",
    "relationship_type": "one_to_many",
    "foreign_key": "progress_records.user_id",
    "references": "users.id",
    "required": true,
    "unique": false,
    "index_required": true,
    "nullable": false,
    "migration_ref": "database/migrations/022_create_progress_records.sql",
    "notes": "Constraint física declarada dentro de la migración canónica de la tabla que contiene la FK. DB ON DELETE refleja la constraint SQL real; application_delete_policy refleja la política lógica de aplicación. Runtime MVP de gamificación persistente exige user_id NOT NULL; eventos sin usuario pueden auditarse, pero no generan progreso, logros ni cooldowns persistentes.",
    "db_on_delete": "RESTRICT",
    "application_delete_policy": "logical_cascade"
  },
  {
    "relationship_id": "REL-010",
    "from_entity": "DomainEvent",
    "to_entity": "AuditLog",
    "relationship_type": "polymorphic_reference",
    "foreign_key": "audit_logs.target_id",
    "references": null,
    "required": true,
    "unique": false,
    "index_required": true,
    "nullable": false,
    "migration_ref": "database/migrations/010_create_audit_logs.sql",
    "notes": "Constraint física declarada dentro de la migración canónica de la tabla que contiene la FK. DB ON DELETE refleja la constraint SQL real; application_delete_policy refleja la política lógica de aplicación.",
    "db_on_delete": "NO_PHYSICAL_FK",
    "application_delete_policy": "polymorphic_append_only"
  },
  {
    "relationship_id": "REL-011",
    "from_entity": "DomainEvent",
    "to_entity": "ProgressRecord",
    "relationship_type": "one_to_many",
    "foreign_key": "progress_records.source_event_id",
    "references": "domain_events.id",
    "required": true,
    "unique": false,
    "index_required": true,
    "nullable": false,
    "migration_ref": "database/migrations/022_create_progress_records.sql",
    "notes": "MVP event-driven: ProgressRecord.source_event_id es NOT NULL. Los ajustes manuales/admin quedan post_mvp hasta acción, permiso, ApprovalRecord e idempotency_key específicos.",
    "db_on_delete": "RESTRICT",
    "application_delete_policy": "logical_cascade"
  },
  {
    "relationship_id": "REL-012",
    "from_entity": "AIActionLog",
    "to_entity": "AuditLog",
    "relationship_type": "polymorphic_reference",
    "foreign_key": "audit_logs.target_id",
    "references": null,
    "required": true,
    "unique": false,
    "index_required": true,
    "nullable": false,
    "migration_ref": "database/migrations/010_create_audit_logs.sql",
    "notes": "Constraint física declarada dentro de la migración canónica de la tabla que contiene la FK. DB ON DELETE refleja la constraint SQL real; application_delete_policy refleja la política lógica de aplicación.",
    "db_on_delete": "NO_PHYSICAL_FK",
    "application_delete_policy": "polymorphic_append_only"
  },
  {
    "relationship_id": "REL-013",
    "from_entity": "Module",
    "to_entity": "Integration",
    "relationship_type": "one_to_many",
    "foreign_key": "integrations.module_id",
    "references": "modules.id",
    "required": true,
    "unique": false,
    "index_required": true,
    "nullable": false,
    "migration_ref": "database/migrations/024_create_integrations.sql",
    "notes": "Constraint física declarada dentro de la migración canónica de la tabla que contiene la FK. DB ON DELETE refleja la constraint SQL real; application_delete_policy refleja la política lógica de aplicación.",
    "db_on_delete": "RESTRICT",
    "application_delete_policy": "logical_cascade"
  },
  {
    "relationship_id": "REL-014",
    "from_entity": "ApprovalRecord",
    "to_entity": "AIActionLog",
    "relationship_type": "one_to_many_optional",
    "foreign_key": "ai_action_logs.approval_id",
    "references": "approval_records.id",
    "required": false,